{
  "rubricVersion": "2.0.0",
  "runId": "claude-haiku-4-5-20251001-2",
  "stage": 2,
  "evaluator": "",
  "evaluatedAt": "",
  "summary": "",
  "categories": [
    {
      "id": "visualFidelity",
      "criteria": [
        {
          "id": "referenceRetention",
          "rating": null,
          "evidence": []
        },
        {
          "id": "responsiveChassis",
          "rating": null,
          "evidence": []
        }
      ]
    },
    {
      "id": "featureCompletion",
      "criteria": [
        {
          "id": "inputCoverage",
          "rating": null,
          "evidence": []
        },
        {
          "id": "pianoControls",
          "rating": null,
          "evidence": []
        },
        {
          "id": "displayAndStatus",
          "rating": null,
          "evidence": []
        }
      ]
    },
    {
      "id": "audioQuality",
      "criteria": [
        {
          "id": "soundSource",
          "rating": null,
          "evidence": []
        },
        {
          "id": "noteLifecycle",
          "rating": null,
          "evidence": []
        },
        {
          "id": "velocityAndControls",
          "rating": null,
          "evidence": []
        },
        {
          "id": "sustainAndPolyphony",
          "rating": null,
          "evidence": []
        }
      ]
    },
    {
      "id": "interactionQuality",
      "criteria": [
        {
          "id": "playability",
          "rating": null,
          "evidence": []
        },
        {
          "id": "controlFeedback",
          "rating": null,
          "evidence": []
        },
        {
          "id": "failureHandling",
          "rating": null,
          "evidence": []
        }
      ]
    },
    {
      "id": "engineeringQuality",
      "criteria": [
        {
          "id": "audioArchitecture",
          "rating": null,
          "evidence": []
        },
        {
          "id": "performanceAndCleanup",
          "rating": null,
          "evidence": []
        }
      ]
    }
  ],
  "issues": []
}
